{
  "schema_version": "villani.codex_coder_result.v1",
  "status": "completed",
  "summary": "Updated the fixture in the isolated candidate worktree.",
  "tests_run": [
    {
      "command": "python -m pytest -q",
      "reported_exit_status": 0,
      "reported_result": "passed"
    }
  ],
  "known_limitations": [],
  "files_the_agent_believes_changed": ["src/example.py"]
}
